"gap_id","priority","area","count","description","source","next_action"
"object-name-description-link","alta","objects","2994","Registros con icono pero sin ficha textual visible completa.","object-search-database.csv / item-text-strings.csv","Relacionar índices de TextAssets, goods IDs y nombres traducidos."
"object-source-param-link","alta","objects","249","Fuentes internas detectadas; la relación type/param no siempre identifica un objeto único.","item-source-database.csv","Resolver parámetros contra goods, objetos y tablas de actividad."
"dungeon-icon-scene-link","alta","dungeons","619","Los iconos de dungeon están catalogados, pero falta unir de forma segura icono, escena, capítulo, requisitos, objetivos y recompensas.","dungeons.csv / dungeon-boss-monster-evidence.csv","Extraer tablas de escena y contrastarlas con el menú del juego."
"lua-bytecode-fields","alta","mechanics","19225","TextAssets del cliente; algunos campos están serializados como bytecode Lua y no exponen directamente todas las relaciones.","text-assets-index.csv","Decodificar estructuras o contrastar con capturas del juego."
"zodiac-master-catalog","media","zodiac","1","El CSV zodiac.csv existente está vacío, aunque hay configuraciones, iconos y Glyph extraídos.","zodiac.csv / zodiac-icons.csv / configs godRune","Construir el catálogo Zodiac/Glyph desde las configuraciones internas."
"model-class-item-link","media","models","102","Modelos 3D extraídos sin asociación segura con clase, género, objeto o outfit.","model-catalog-full.csv","Relacionar model_id/surface_id con fichas y probarlo en juego."
"ldstore-semantic-diff","media","versions","1128","La versión Google Play y la versión LDStore se conservan separadas; existen recursos semánticamente distintos aún no fusionados.","juego-extraido / juego-extraido-ldstore","Generar diff por bundle, asset y texto antes de consolidar."
"server-runtime-data","alta","runtime","1","Recompensas, disponibilidad por servidor, cuentas y eventos dinámicos no se garantizan desde el cliente extraído.","cliente extraído","Registrar solo lo observable en el juego y marcar la fecha/servidor."
"monster-id-name-link","alta","monsters","765","Hay nombres de monstruos/bosses sin correspondencia inequívoca con monster_id en el catálogo cliente.","monster-name-unique.csv / monster-client-catalog.csv","Resolver con claves de escena, dungeonTarget o captura del menú."
"zodiac-glyph-values","media","zodiac","180","Se localizaron nombres, iconos y claves Glyph/Transform, pero no todos los valores, huecos y compatibilidades están serializados de forma legible.","zodiac-glyph-transfigure-evidence.csv / transform-glyph-evidence.csv / zodiac-icons.csv","Unir con fichas visuales y capturas de cada pantalla."
"boss-resistance-values","alta","bosses","8","Aparecen campos isweak/resist/def, pero sus valores completos están serializados o requieren interpretar tablas LuaJIT.","boss-weakness-status.csv / monster-client-catalog.csv","Decodificar tablas o capturar estadísticas de boss."
